Title,Source,Description
Jellies & Gummies Global Market Report 2023,Yahoo Entertainment,"Major players in the jellies & gummies market are Haribo, Cloetta, Ferrara Candy, Nestle, Mondelez International Inc., Mars Inc., Jelly Belly Candy Company, ..."
Apple shareholders approve board and pay packages; outside proposals rejected,Macdailynews.com,"Apple on Friday hosted its 2023 Annual Meeting of Shareholders on March 10, 2023 at 9:00 am P.T. in a virtual format. Apple investors…
The post Apple shareholders approve board and pay packages; outside proposals rejected appeared first on MacDailyNews."
"China Gift Card and Incentive Card Market Intelligence and Future Growth Dynamics (Databook) - Q1 2023 Update: Featuring Alibaba, JD.com, WalMart, Apple, Yonghui & More",Yahoo Entertainment,"Dublin, March 10, 2023 (GLOBE NEWSWIRE) -- The ""China Gift Card and Incentive Card Market Intelligence and Future Growth Dynamics (Databook) - Q1 2023 Update..."
"Hedge Fund Elliott’s Win Is A Victory For Japan, Too",Forbes,"What Elliott views as a case study in extracting hidden value could be its own blueprint for how to build a more innovative, productive and competitive Japan."
Apple shareholders reject proposals from conservative groups,CNA,Apple Inc shareholders on Friday rejected two shareholder proposals put forth by conservative U.S. groups focused on scrutinizing the iPhone maker's inclusion and diversity policies and its ties to China.Shareholders also approved the company's executive pay …
