Title,Source,Description
Xenon Pharmaceuticals Inc. (NASDAQ:XENE) Q4 2022 Earnings Call Transcript,Yahoo Entertainment,"Xenon Pharmaceuticals Inc. (NASDAQ:XENE) Q4 2022 Earnings Call Transcript March 1, 2023 Operator: Ladies and gentlemen, thank you for standing by, and..."
"Samsara Luggage Reaches Next Level with Consecutive ""Best of"" Mentions in the Press",PRNewswire,"Samsara Luggage secures ""Best of"" placements in significant publications including Forbes, Travel + Leisure and Buy Side from WSJ. NEW YORK, March 6, 2023 /PRNewswire/ -- Samsara Luggage (OTCQB: SAML), maker of innovative travel products, today announced that…"
CARBONTECH CAPITAL CORP. ANNOUNCES PROPOSED QUALIFYING TRANSACTION WITH HAPPI VENTURES INC. AND TERMINATION OF ITS PREVIOUSLY ANNOUNCED TRANSACTION,Yahoo Entertainment,"CarbonTech Capital Cop. (TSXV: CT.P) (""CT""), a capital pool company listed on the TSX Venture Exchange (the ""Exchange""), is pleased to announce that it has..."
Pet insurance market size to grow at a CAGR of 31.41% between 2022 and 2027; Growth driven by rising concerns over the well-being of pets - Technavio,Yahoo Entertainment,"According to Technavio, the global pet insurance market size is estimated to grow by USD 19,852.9 million between 2022 and 2027. The market is estimated to..."
"Foam Tape Market Size to Reach USD 18.6 Billion by 2032, Says The Brainy Insights",Yahoo Entertainment,"The growing demand for adhesives, the increasing automotive industry, and the rising usage of electronic devices in emerging region are expected to support..."
