Title,Source,Description
"Apple Arcade Guide: What’s available for iPhone, Apple TV [New: Award-winning Osmos+]",9to5Mac,"Apple Arcade launched with close to 100 titles and the service is seeing new games added regularly with over 200 games now in the library. Follow along with our guide on all the available Apple Arcade games.
 more…
The post Apple Arcade Guide: What’s availabl…"
"The Beachbody Company, Inc. (NYSE:BODY) Q4 2022 Earnings Call Transcript",Yahoo Entertainment,"The Beachbody Company, Inc. (NYSE:BODY) Q4 2022 Earnings Call Transcript March 14, 2023 Operator: Good afternoon, ladies and gentlemen. Welcome to The..."
XPeng (XPEV) Q4 2022 Earnings Call Transcript,Motley Fool,"XPEV earnings call for the period ending December 31, 2022."
Bioresorbable Polymers Market is Expected to Grow at a CAGR of 10.2% by 2030 | Research by SNS insider,Yahoo Entertainment,"Bioresorbable Polymers Market Segmentation By Type (PLA, PGA, PLGA, PCL, Others), By Application (Orthopedic devices, Drug delivery, Others), by Regions..."
