Title,Source,Description
Apple Arcade Guide: Everything that’s available [New: Clue – The Classic Mystery Game],9to5Mac,"Apple Arcade launched with close to 100 titles and the service is seeing new games added regularly with over 200 games now in the library. Follow along with our guide on all the available Apple Arcade games.
 more…
The post Apple Arcade Guide: Everything that…"
CROMBIE REIT ANNOUNCES OFFERING OF $200 MILLION SERIES K UNSECURED NOTES,Yahoo Entertainment,"Crombie Real Estate Investment Trust (""Crombie"" or the ""REIT"") (TSX: CRR.UN), announced today that it entered into an agreement to issue $200 million..."
"Cue Biopharma, Inc. (NASDAQ:CUE) Q4 2022 Earnings Call Transcript",Yahoo Entertainment,"Cue Biopharma, Inc. (NASDAQ:CUE) Q4 2022 Earnings Call Transcript March 21, 2023 Operator: Greetings, and welcome to the Cue Biopharma Fourth Quarter and..."
Offices Find New Ways to Compete With Hotels For Remote Workers,Skift,"Companies that went hybrid are now being urged to ""reuse"" their office spaces by renting them out to other remote workers. Here we go again. -Matthew Parsons"
Tesla Is Losing a Big Force Behind This Year’s Rally,Yahoo Entertainment,(Bloomberg) -- A key force behind this year’s rally in Tesla Inc. shares is losing momentum.Most Read from BloombergDeutsche Bank Drops in Selloff Citi...
Global Cannabis-infused Edibles Market Report (2023-2028): Growing Cannabis Legalization and Elevating Popularity of Home-Grown Cannabis Bolsters Sector,Yahoo Entertainment,"Global Cannabis-infused Edibles Market Global Cannabis-infused Edibles Market Dublin, March 24, 2023 (GLOBE NEWSWIRE) -- The ""Global Cannabis-infused Edibles..."
Global Fertility Testing Market Report (2023-2028): Declining Fertility Rates Bolsters Growth,Yahoo Entertainment,"Dublin, March 24, 2023 (GLOBE NEWSWIRE) -- The ""Global Fertility Testing Market (2023-2028) by Product, Mode of Purchase, Applications, End-Users, and..."
Last Mile Delivery Market to Reach USD 357.45 Billion to 2031 | Reveals Exclusive InsightAce Study,GlobeNewswire,"Companies Covered in this Study are A1 Express Services Inc., Amazon.com, Aramex, BEST Inc, DPD, Drone Delivery Canada, Dropoff, Inc., DSV (DSV PANALPINA), FedEx, Flirtey, Flytrex, Geodis, Jet Delivery, Inc., DB Schenker Companies Covered in this Study are A1…"
