Title,Source,Description
Boeing and Airbus intensify search for skilled talent in India,Moneycontrol,"Airbus plans to hire 1,000 people in India this year out of 13,000 globally. Boeing and its suppliers, which already employ about 18,000 workers in the nation, have been growing by some 1,500 staff every year, the US jet manufacturerâs India head Salil Gupt…"
"Boeing Wins $1.9Bln Contract to Build More Army Apache Combat Helicopters, Pentagon Reports",Sputnik International,"WASHINGTON (Sputnik) - Boeing has received an almost $2bln US Army contract to produce more Apache AH-64E ground support combat helicopters over the next five years, the Department of Defense announced in a press release."
J.F. Lehman & Company Acquires Atlas Air Worldwide In Partnership With Apollo and Hill City Capital,Yahoo Entertainment,"Atlas Air Worldwide (""Atlas,"" ""AAWW"" or the ""Company""), a leading global provider of outsourced aircraft and aviation operating services, today announced..."
"Virgin Orbit suspends operations, in wake of failed orbital launch",Space Daily,"Washington DC (UPI) Mar 16, 2021


 Satellite launch provider Virgin Orbit said Thursday it was suspending operations with immediate effect. 
 The company confirmed the ""company-wide operational pause"" to CNBC and the BBC while saying it would provide ""an upd…"
"Investor Group Led by Apollo, Together With J.F. Lehman & Company and Hill City Capital, Completes Acquisition of Atlas Air Worldwide",Yahoo Entertainment,"Atlas Air Worldwide Becomes Privately Held CompanyPURCHASE, N.Y., March 17, 2023 (GLOBE NEWSWIRE) -- Atlas Air Worldwide (“Atlas,” “AAWW” or the “Company”), ..."
Boeing Says There Was No Pain or Suffering in 737 Max Crash Because Everyone Died Instantly,Jalopnik,"We’re one week past the four-year anniversary of the crash of Ethiopian Airlines Flight 302, which went down in Ethiopia shortly after takeoff on March 10, 2019, killing all 157 people onboard. It was the second crash involving a Boeing 737 Max airplane, occu…"
